{
  "product_name": "top-skill-factory",
  "current_version": "1.1.1",
  "release_channel": "stable",
  "update_check_strategy": "manifest-compare",
  "manifest_source": "Local manifest compare by default. A trusted newer release-metadata.json file may be provided explicitly.",
  "notes": "TOP Skill Factory 1.1.1 normalizes TOP Prompt Cleaner display naming in factory onboarding and conversion demo artifacts.",
  "startup_update_check_supported": true
}
