{
  "product_name": "top-skill",
  "current_version": "1.1.1",
  "release_channel": "stable",
  "update_check_strategy": "manifest-compare",
  "manifest_source": "Local manifest compare by default. Provide a trusted release-metadata.json from a newer top-skill snapshot when comparison is needed.",
  "notes": "top-skill is the foundational stable TOP skill package. Update checking is supported but depends on an explicitly provided comparison manifest.",
  "startup_update_check_supported": true
}
